url,name,address,city,state,phone
http://www.ampeisch.com/,Results,"ÓÉą1020 Memorial Dr, St Johnsbury, VT 05819",St Johnsbury,VT,Óāį(802) 748-5654
http://greenmountainaccounting.com/,Results,"ÓÉą996 S Main St, Stowe, VT 05672",Stowe,VT,Óāį(802) 279-2055
https://www.osbcpa.com/,Results,"ÓÉą192 S Main St, Barre, VT 05641",Barre,VT,Óāį(802) 476-9698
http://mstuartassociates.com/,Results,"ÓÉą206 S Main St, Hardwick, VT 05843",Hardwick,VT,Óāį(802) 472-6192
http://www.77bookkeeping.com/,Results,"ÓÉą77 Blackwell St, Barre, VT 05641",Barre,VT,Óāį(802) 333-0063
http://www.leewhitecpa.com/,Results,"ÓÉą86 Summer St Suite 1, Barre, VT 05641",Barre,VT,Óāį(802) 476-6191
http://www.thediligentcpa.com/,Results,"ÓÉą162 Elm St, Montpelier, VT 05602",Montpelier,VT,Óāį(802) 433-3833
http://paceandhawley.com/,Results,"ÓÉą250 Main St, Montpelier, VT 05602",Montpelier,VT,Óāį(802) 461-2587
https://clearaccountingfirm.com/?utm_source=google&utm_medium=organic&utm_campaign=seolocale,Results,"ÓÉą368 Brush Hill Rd, Stowe, VT 05672",Stowe,VT,Óāį(802) 648-1151
http://www.fsv-cpas.com/,Results,"ÓÉą143 Barre St, Montpelier, VT 05602",Montpelier,VT,Óāį(802) 223-6261
http://www.sullivanpowers.com/firm_profile.html,Results,"ÓÉą77 Barre St, Montpelier, VT 05602",Montpelier,VT,Óāį(802) 223-2352
https://www.facebook.com/jklangllc,Results,"ÓÉąBoomhower Rd, Woodsville, NH 03785",Woodsville,NH,Óāį(603) 747-3613
http://www.alpinevt.com/,Results,"ÓÉą377 Mountain Rd, Stowe, VT 05672",Stowe,VT,Óāį(802) 253-4561
https://www.salvadorandbabic.com/,Results,"ÓÉą240 S Main St, Barre, VT 05641",Barre,VT,Óāį(802) 476-8673
http://www.cussonstaxprep.com/,Results,"ÓÉą540 Route 15E #2, Hyde Park, VT 05655",Hyde Park,VT,Óāį(802) 888-2630
http://abacusvt.com/,Results,"ÓÉą338 River St #1, Montpelier, VT 05602",Montpelier,VT,Óāį(802) 225-8907
https://greenmountainbookkeeper.com/,Results,"ÓÉą338 VT-113, Chelsea, VT 05038",Chelsea,VT,
https://www.nekbookkeepingservices.com/,Results,"ÓÉą589 Walters Farm Rd, East Haven, VT 05837",East Haven,VT,Óāį(802) 473-0408
https://gilweegroup.com/,Results,"ÓÉą15 E State St #2, Montpelier, VT 05602",Montpelier,VT,Óāį(802) 304-4424
https://www.sullivanpowers.com/,Results,"ÓÉą77 Barre St, Montpelier, VT 05602",Montpelier,VT,Óāį(802) 223-2352
http://www.batcheldercpa.com/,Results,"ÓÉą1 Conti Cir #1, Barre, VT 05641",Barre,VT,Óāį(802) 476-9490
https://agaaccounting.com/contact/request-appointment/,Results,"ÓÉą158 Portland St, Morristown, VT 05661",Morristown,VT,Óāį(802) 448-5593
https://www.jpwaccountingservices.com/,Results,"ÓÉą44 Sunset Lake Rd, Benson, VT 05743",Benson,VT,Óāį(518) 538-3047
https://taxpanacea.com/,Results,"ÓÉą87 State St #990, Montpelier, VT 05601",Montpelier,VT,Óāį(802) 839-8406
https://www.masterpiecebookservice.com/,Results,,Peacham,VT,Óāį(802) 299-9240
http://glennapoundcpa.com/,Results,"ÓÉą3458 W Hill Rd, Stowe, VT 05672",Stowe,VT,Óāį(802) 253-9451
https://www.jmmcpa.net/?utm_source=google&utm_medium=google_business_profile&utm_campaign=website_click,Results,"ÓÉą463 Mountain View Dr Ste 403, Colchester, VT 05446",Colchester,VT,Óāį(802) 655-5665
https://www.hrblock.com/tax-office-near-me/vermont/saint-johnsbury/26676/?otppartnerid=9308&campaignid=pw_mcm_9308_9762&utm_medium=local,Results,"ÓÉąLower Level, 364 Railroad St Ste 23, St Johnsbury, VT 05819",St Johnsbury,VT,Óāį(802) 748-5319
https://www.lmobookkeepingllc.com/,Results,,Peacham,VT,Óāį(603) 575-1087
http://www.janicegrahamcpa.com/,Results,"ÓÉą446 Barnard Rd, Woodstock, VT 05091",Woodstock,VT,Óāį(802) 457-4644
http://www.sullivanpowers.com/contact_us.html,Results,"ÓÉą77 Barre St, Montpelier, VT 05602",Montpelier,VT,Óāį(802) 223-2352
https://www.4seasonsaccounting.com/,Results,"ÓÉą25 Curtis Ave, Rutland, VT 05701",Rutland,VT,Óāį(802) 775-3140
http://www.mcdonnelltax.com/map,Results,"ÓÉą1131 Sharpshooters Rd, Moretown, VT 05660",Moretown,VT,Óāį(802) 279-7603
https://echelonaccounting.com/,Results,"ÓÉą111 Saranac St STE 1, Littleton, NH 03561",Littleton,NH,Óāį(603) 991-0428
http://www.hall-holden-pc.com/,Results,"ÓÉą705 Mill Brook Rd, Waitsfield, VT 05673",Waitsfield,VT,Óāį(802) 496-3140
http://www.genesisconsultingcorp.com/,Results,"ÓÉą15 Woods Edge Rd, Cambridge, VT 05444",Cambridge,VT,Óāį(802) 393-1200
https://sdaccountingvt.com/,Results,"ÓÉą419 VT-105 Suite B, Newport, VT 05855",Newport,VT,Óāį(802) 624-4148
https://www.thediligentcpa.com/contact,Results,"ÓÉą162 Elm St, Montpelier, VT 05602",Montpelier,VT,Óāį(802) 343-0316
http://www.keelercpa.com/,Results,"ÓÉą110 Cottage St, Littleton, NH 03561",Littleton,NH,Óāį(603) 444-7272
http://greenstatecpa.com/,Results,,Peacham,VT,
https://www.gdp-cpa.com/,Results,"ÓÉą3 Baldwin Ave, South Burlington, VT 05403",South Burlington,VT,Óāį(802) 846-2000
http://www.cpa-vermont.com/,Results,"ÓÉą66 Grove St, Rutland, VT 05701",Rutland,VT,Óāį(802) 775-3221
https://berwickagency.com/,Results,"ÓÉą185 Church St, Peacham, VT 05862",Peacham,VT,Óāį(802) 592-3234
https://www.summitbookkeeping.us/,Results,,Peacham,VT,Óāį(802) 710-6752
http://www.getledgr.co/,Results,,Peacham,VT,Óāį(877) 425-2329
http://capitalaccounting.org/,Results,"ÓÉą606 W Hill Rd, North Middlesex, VT 05682",North Middlesex,VT,Óāį(802) 229-5988
https://www.pwc.com/,Results,"ÓÉąOne National Life Dr, Montpelier, VT 05602",Montpelier,VT,Óāį(802) 229-7553
http://ktsmonroe.com/,Results,"ÓÉą131 Harley View Dr, Monroe, NH 03771",Monroe,NH,Óāį(603) 638-2120
https://integrityaccountingllcvt.com/,Results,,Peacham,VT,Óāį(802) 373-5352
http://www.quickstartqb.com/,Results,"ÓÉą600 S Main St, Stowe, VT 05672",Stowe,VT,Óāį(802) 253-6008
https://www.cpasitesolutions.com/?utm_source=google&utm_medium=organic&utm_campaign=gmb&utm_content=website-link,Results,"ÓÉą59 Rathe Rd #110, Colchester, VT 05446",Colchester,VT,Óāį(800) 896-4500
https://www.vtcpa.org/,Results,,Peacham,VT,Óāį(802) 229-4939
http://www.stearnscpa.com/,Results,"ÓÉą900 Pearl St, Brandon, VT 05733",Brandon,VT,Óāį(802) 247-8300
https://splinternetmarketing.com/local-pros/vt/bethel/audrey-m-turk-accounting-tax/,Results,"ÓÉą32 River St Ext, Bethel, VT 05032",Bethel,VT,Óāį(802) 234-5150
http://www.richardpaulcpa.com/,Results,"ÓÉą842 Hartford Ave., White River Junction, VT 05001",White River Junction,VT,Óāį(802) 698-0332
http://www.downeycpa.com/,Results,"ÓÉą10 Park Pl, Brattleboro, VT 05301",Brattleboro,VT,Óāį(802) 257-1307
https://www.jwdurkeecpa.com/about-us,Results,"ÓÉą13 Durkee Rd, Tunbridge, VT 05077",Tunbridge,VT,Óāį(802) 889-3408
https://splinternetmarketing.com/local-pros/vt/whiting/laurie-l-bertrand-cpa-tax-accounting-service/,Results,"ÓÉą116 Schoolhouse Rd, Whiting, VT 05778",Whiting,VT,Óāį(802) 623-6453
http://momentumbusinessvt.com/,Results,"ÓÉą1 Eastern Ave, St Johnsbury, VT 05819",St Johnsbury,VT,Óāį(802) 424-1336
http://www.dh-cpa.com/,Results,"ÓÉą33 Blair Park Rd #201, Williston, VT 05495",Williston,VT,Óāį(802) 878-1963
https://www.herrickglobal.com/,Results,"ÓÉą302 Mountain View Dr #301, Colchester, VT 05446",Colchester,VT,Óāį(802) 864-4514
http://myvermontcpa.com/,Results,"ÓÉą1035 Hinesburg Rd, South Burlington, VT 05403",South Burlington,VT,Óāį(802) 878-9619
https://www.lavalleeco.com/,Results,"ÓÉą20 Susie Wilson Rd Unit 4, Essex Junction, VT 05452",Essex Junction,VT,Óāį(802) 861-2200
http://www.marczaaroncpa.com/,Results,"ÓÉą36 Harlow Hill Rd, Randolph, VT 05060",Randolph,VT,Óāį(802) 728-3857
https://www.compucount.com/,Results,"ÓÉą124 Meadow Ln, Randolph, VT 05060",Randolph,VT,Óāį(802) 728-4461
http://www.kayenliepmann.com/,Results,"ÓÉą295 Main St, Norwich, VT 05055",Norwich,VT,Óāį(802) 649-1689
http://www.angolanoandcompany.com/,Results,"ÓÉą2834 Shelburne Rd, Shelburne, VT 05482",Shelburne,VT,Óāį(802) 985-8992
http://www.wwa-cpa.com/,Results,"ÓÉą159 River Rd, Essex Junction, VT 05452",Essex Junction,VT,Óāį(802) 879-1055
https://peachamvt.org/town-office/,Results,"ÓÉą79 Church St, Peacham, VT 05862",Peacham,VT,Óāį(802) 592-3218
http://birchtreetax.com/,Results,"ÓÉą145 Pine Haven Shores #1021, Shelburne, VT 05482",Shelburne,VT,Óāį(802) 985-1236
https://buttonservices.com/,Results,"ÓÉą1011 N Main St Suite 28, White River Junction, VT 05001",White River Junction,VT,Óāį(802) 404-5060
http://integritytaxvt.com/,Results,"ÓÉą155 Duchess Ave Ste C109, Newport, VT 05855",Newport,VT,Óāį(802) 673-5750
http://www.myerstaxvt.com/,Results,"ÓÉą1 Market Pl Unit #1, Essex Junction, VT 05452",Essex Junction,VT,Óāį(802) 871-5376
http://donnastaxservice.com/,Results,"ÓÉą588 Jewett Ave, Swanton, VT 05488",Swanton,VT,Óāį(802) 524-2709
https://splinternetmarketing.com/local-pros/vt/milton-1/dorothys-tax-business-inc/,Results,"ÓÉą71 Racine Rd, Milton, VT 05468",Milton,VT,Óāį(802) 893-6989
http://www.robertrichtax.com/,Results,"ÓÉą600 Blair Park Rd, Williston, VT 05495",Williston,VT,Óāį(802) 862-1381
https://taxprosvtgmail.com/,Results,"ÓÉą12 1st St A, Swanton, VT 05488",Swanton,VT,Óāį(802) 868-9575
http://www.taxteamvt.com/,Results,"ÓÉą86 Court St, Middlebury, VT 05753",Middlebury,VT,Óāį(802) 388-6603
http://www.catamountaccounting.com/,Results,"ÓÉą25 Wentworth Dr, Williston, VT 05495",Williston,VT,Óāį(802) 578-7896
https://www.northworksbookkeeping.com/,Results,,Peacham,VT,Óāį(802) 343-0796
http://www.advisortaxservices.com/,Results,"ÓÉą56 Old Farm Rd, Stowe, VT 05672",Stowe,VT,
http://emhayescpa.com/,Results,"ÓÉą411 E Main St, Newport, VT 05855",Newport,VT,Óāį(802) 334-2201
http://www.zarinalaw.com/contact-information,Results,"ÓÉą215 Corner Rd, Hardwick, VT 05843",Hardwick,VT,Óāį(802) 535-7117
http://www.abacusmanagementinc.com/,Results,"ÓÉą75 ŠąěŠąÉŠčćŠä≠ ŠąėŠäēŠĆąŠčĶ, Colebrook, NH 03576",Colebrook,NH,Óāį(603) 237-5543
http://budbloombooks.com/,Results,,Peacham,VT,
